<?xml version="1.0" encoding="UTF-8"?>
<!DOCTYPE RoboSimulation SYSTEM "RoboSim.dtd">
<RoboSimulation>
    <SimulationName>Симулация 3</SimulationName>
    <SimulationOwner>Петър</SimulationOwner>
    <SimulationOwnerEmail>petur@gmail.com</SimulationOwnerEmail>
    <Environments>
        <Environment id="IDE000" name="Земя">
            <TravelCostEnter>1.0</TravelCostEnter>
            <TravelCostIn>1.0</TravelCostIn>
            <TravelCostExit>1.0</TravelCostExit>
            <Damage>0.0</Damage>
        </Environment>
        <Environment id="IDE001" name="Вода">
            <TravelCostEnter>1.6</TravelCostEnter>
            <TravelCostIn>2.1</TravelCostIn>
            <TravelCostExit>1.8</TravelCostExit>
            <Damage>1.5</Damage>
        </Environment>
        <Environment id="IDE002" name="Въздух">
            <TravelCostEnter>1.2</TravelCostEnter>
            <TravelCostIn>0.6</TravelCostIn>
            <TravelCostExit>0.0</TravelCostExit>
            <Damage>0.0</Damage>
        </Environment>     
    </Environments>
    
    <Robots>
        <Robot id="IDR000" environments="IDE000 IDE001" name="Робо A4000" owner="Иван">
            <RobotMeshGrid>mesh.obj</RobotMeshGrid>
            <Speed>13.0</Speed>
            <SpeedBack>13.3</SpeedBack>
            <TurningSpeed>8.0</TurningSpeed>
            <TurningSpeedBack>8.2</TurningSpeedBack>
            <Wheels>
                <Wheel driving="ДА">
                    <WheelMeshGrid>wheelMesh0.obj</WheelMeshGrid>
                    <WheelDiameter>1.5</WheelDiameter>
                    <WheelWidth>1.0</WheelWidth>
                </Wheel>
                <Wheel driving="ДА">
                    <WheelMeshGrid>wheelMesh1.obj</WheelMeshGrid>
                    <WheelDiameter>1.5</WheelDiameter>
                    <WheelWidth>1.0</WheelWidth>
                </Wheel>
                <Wheel driving="ДА">
                    <WheelMeshGrid>wheelMesh2.obj</WheelMeshGrid>
                    <WheelDiameter>2.0</WheelDiameter>
                    <WheelWidth>1.0</WheelWidth>
                </Wheel>
            </Wheels>
            <Sensors>
                <Sensor name="Сензор за измерване на топлината" valueType="топлина">
                    <SensorMeshGrid>tempSensorMesh.obj</SensorMeshGrid>
                    <NumberOfValusPerSecond>5</NumberOfValusPerSecond>
                </Sensor>
                <Sensor name="Сензор за измерване на разстоянието" valueType="разстояние">
                    <SensorMeshGrid>distSensorMesh.obj</SensorMeshGrid>
                    <NumberOfValusPerSecond>5</NumberOfValusPerSecond>
                </Sensor>
            </Sensors>
        </Robot>        
        <Robot id="IDR001" environments="IDE000 IDE002" name="Робо Б4000" owner="Мартин">
            <RobotMeshGrid>mesh.obj</RobotMeshGrid>
            <Speed>19.0</Speed>
            <SpeedBack>19.3</SpeedBack>
            <TurningSpeed>10.5</TurningSpeed>
            <TurningSpeedBack>10.2</TurningSpeedBack>
            <Wheels>
                <Wheel driving="ДА">
                    <WheelMeshGrid>wheelMesh0.obj</WheelMeshGrid>
                    <WheelDiameter>5.0</WheelDiameter>
                    <WheelWidth>1.2</WheelWidth>
                </Wheel>
                <Wheel driving="НЕ">
                    <WheelMeshGrid>wheelMesh1.obj</WheelMeshGrid>
                    <WheelDiameter>2.8</WheelDiameter>
                    <WheelWidth>1.2</WheelWidth>
                </Wheel>
                <Wheel driving="НЕ">
                    <WheelMeshGrid>wheelMesh2.obj</WheelMeshGrid>
                    <WheelDiameter>2.8</WheelDiameter>
                    <WheelWidth>1.2</WheelWidth>
                </Wheel>
            </Wheels>
            <Sensors>
                <Sensor name="Сензор за измерване на топлината" valueType="топлина">
                    <SensorMeshGrid>tempSensorMesh.obj</SensorMeshGrid>
                    <NumberOfValusPerSecond>5</NumberOfValusPerSecond>
                </Sensor>
                <Sensor name="Сензор за измерване на разстоянието" valueType="разстояние">
                    <SensorMeshGrid>distSensorMesh.obj</SensorMeshGrid>
                    <NumberOfValusPerSecond>5</NumberOfValusPerSecond>
                </Sensor>
            </Sensors>
            <Rotors>
                <Rotor>
                    <RotorMeshGrid>RotorMesh0.obj</RotorMeshGrid>
                    <RotorLiftingPower>2.0</RotorLiftingPower>
                </Rotor>
                <Rotor>
                    <RotorMeshGrid>RotorMesh1.obj</RotorMeshGrid>
                    <RotorLiftingPower>2.0</RotorLiftingPower>
                </Rotor>
            </Rotors>
        </Robot>        
        <Robot id="IDR002" environments="IDE000 IDE001 IDE002" name="Робо В4000" owner="Иван">
            <RobotMeshGrid>mesh.obj</RobotMeshGrid>
            <Speed>24.2</Speed>
            <SpeedBack>24.1</SpeedBack>
            <TurningSpeed>24.0</TurningSpeed>
            <TurningSpeedBack>24.6</TurningSpeedBack>
            <Wheels>
                <Wheel driving="ДА">
                    <WheelMeshGrid>wheelMesh0.obj</WheelMeshGrid>
                    <WheelDiameter>3.0</WheelDiameter>
                    <WheelWidth>1.3</WheelWidth>
                </Wheel>
                <Wheel driving="ДА">
                    <WheelMeshGrid>wheelMesh1.obj</WheelMeshGrid>
                    <WheelDiameter>3.0</WheelDiameter>
                    <WheelWidth>1.3</WheelWidth>
                </Wheel>
                <Wheel driving="ДА">
                    <WheelMeshGrid>wheelMesh2.obj</WheelMeshGrid>
                    <WheelDiameter>4.0</WheelDiameter>
                    <WheelWidth>1.3</WheelWidth>
                </Wheel>
                <Wheel driving="ДА">
                    <WheelMeshGrid>wheelMesh3.obj</WheelMeshGrid>
                    <WheelDiameter>4.0</WheelDiameter>
                    <WheelWidth>1.3</WheelWidth>
                </Wheel>
            </Wheels>
            <Sensors>
                <Sensor name="Сензор за измерване на разстоянието" valueType="разстояние">
                    <SensorMeshGrid>distSensorMesh.obj</SensorMeshGrid>
                    <NumberOfValusPerSecond>5</NumberOfValusPerSecond>
                </Sensor>
            </Sensors>
            <Rotors>
                <Rotor>
                    <RotorMeshGrid>RotorMesh0.obj</RotorMeshGrid>
                    <RotorLiftingPower>2.0</RotorLiftingPower>
                </Rotor>
                <Rotor>
                    <RotorMeshGrid>RotorMesh1.obj</RotorMeshGrid>
                    <RotorLiftingPower>2.0</RotorLiftingPower>
                </Rotor>
                <Rotor>
                    <RotorMeshGrid>RotorMesh2.obj</RotorMeshGrid>
                    <RotorLiftingPower>1.0</RotorLiftingPower>
                </Rotor>
                <Rotor>
                    <RotorMeshGrid>RotorMesh3.obj</RotorMeshGrid>
                    <RotorLiftingPower>1.0</RotorLiftingPower>
                </Rotor>
            </Rotors>
        </Robot>           
        <Robot id="IDR003" environments="IDE002" name="Робо Г4000" owner="Тони">
            <RobotMeshGrid>mesh.obj</RobotMeshGrid>
            <Speed>32.0</Speed>
            <SpeedBack>30.8</SpeedBack>
            <TurningSpeed>26.25</TurningSpeed>
            <TurningSpeedBack>28.2</TurningSpeedBack>
            <Sensors>
                <Sensor name="Сензор за измерване на топлината" valueType="топлина">
                    <SensorMeshGrid>tempSensorMesh.obj</SensorMeshGrid>
                    <NumberOfValusPerSecond>5</NumberOfValusPerSecond>
                </Sensor>
                <Sensor name="Сензор за измерване на разстоянието" valueType="разстояние">
                    <SensorMeshGrid>distSensorMesh.obj</SensorMeshGrid>
                    <NumberOfValusPerSecond>5</NumberOfValusPerSecond>
                </Sensor>
            </Sensors>
            <Rotors>
                <Rotor>
                    <RotorMeshGrid>RotorMesh0.obj</RotorMeshGrid>
                    <RotorLiftingPower>5.0</RotorLiftingPower>
                </Rotor>
                <Rotor>
                    <RotorMeshGrid>RotorMesh1.obj</RotorMeshGrid>
                    <RotorLiftingPower>5.0</RotorLiftingPower>
                </Rotor>
                <Rotor>
                    <RotorMeshGrid>RotorMesh2.obj</RotorMeshGrid>
                    <RotorLiftingPower>6.0</RotorLiftingPower>
                </Rotor>
                <Rotor>
                    <RotorMeshGrid>RotorMesh3.obj</RotorMeshGrid>
                    <RotorLiftingPower>6.0</RotorLiftingPower>
                </Rotor>
            </Rotors>
        </Robot>   
    </Robots>
    
    <Maps>
        <Map id="IDM000" environments="IDE000 IDE001 IDE002">
            <MapData>map000.bin</MapData>
            <Denivelation>15</Denivelation>
        </Map>
    </Maps>
    
    <Algorithms>
        <Algorithm id="IDA000" name="А звезда" diffEnvironments="ДА" multipleDestPoints="НЕ">
            <Complexity>Зависи от евристиката</Complexity>
            <Depth>35</Depth>
        </Algorithm>  
    </Algorithms>
</RoboSimulation>