<?xml version="1.0" encoding="UTF-8"?>
<!DOCTYPE RoboSimulation SYSTEM "RoboSim.dtd">
<RoboSimulation id="S0">
    <SimulationName>Симулация 11</SimulationName>
    <SimulationOwner>Биби</SimulationOwner>
    <SimulationOwnerEmail>bibi@gmail.com</SimulationOwnerEmail>
    <Environments>
        <Environment id="IDE000" name="Земя">
            <TravelCostEnter>1.2</TravelCostEnter>
            <TravelCostIn>1.2</TravelCostIn>
            <TravelCostExit>1.2</TravelCostExit>
            <Damage>0.1</Damage>
        </Environment>
        <Environment id="IDE001" name="Вода">
            <TravelCostEnter>1.1</TravelCostEnter>
            <TravelCostIn>3.1</TravelCostIn>
            <TravelCostExit>4.8</TravelCostExit>
            <Damage>1.7</Damage>
        </Environment>
        <Environment id="IDE002" name="Въздух">
            <TravelCostEnter>1.2</TravelCostEnter>
            <TravelCostIn>0.5</TravelCostIn>
            <TravelCostExit>0.3</TravelCostExit>
            <Damage>0.1</Damage>
        </Environment>     
    </Environments>
    
    <Robots>
        <Robot id="IDR000" environments="IDE000 IDE002" name="Робо СМ21" owner="Алекс">
            <RobotMeshGrid>mesh.obj</RobotMeshGrid>
            <Speed>14.0</Speed>
            <SpeedBack>14.3</SpeedBack>
            <TurningSpeed>9.0</TurningSpeed>
            <TurningSpeedBack>9.2</TurningSpeedBack>
            <Wheels>
                <Wheel driving="ДА">
                    <WheelMeshGrid>wheelMesh0.obj</WheelMeshGrid>
                    <WheelDiameter>1.8</WheelDiameter>
                    <WheelWidth>1.1</WheelWidth>
                </Wheel>
                <Wheel driving="ДА">
                    <WheelMeshGrid>wheelMesh1.obj</WheelMeshGrid>
                    <WheelDiameter>1.8</WheelDiameter>
                    <WheelWidth>1.1</WheelWidth>
                </Wheel>
                <Wheel driving="ДА">
                    <WheelMeshGrid>wheelMesh2.obj</WheelMeshGrid>
                    <WheelDiameter>5.0</WheelDiameter>
                    <WheelWidth>1.1</WheelWidth>
                </Wheel>
            </Wheels>
            <Sensors>
                <Sensor name="Сензор за измерване на топлината" valueType="топлина">
                    <SensorMeshGrid>tempSensorMesh.obj</SensorMeshGrid>
                    <NumberOfValusPerSecond>5</NumberOfValusPerSecond>
                </Sensor>
                <Sensor name="Сензор за измерване на разстоянието" valueType="разстояние">
                    <SensorMeshGrid>distSensorMesh.obj</SensorMeshGrid>
                    <NumberOfValusPerSecond>3</NumberOfValusPerSecond>
                </Sensor>
            </Sensors>
        </Robot>        
        <Robot id="IDR001" environments="IDE001 IDE002" name="Робо ИЕ132" owner="Пешо">
            <RobotMeshGrid>mesh.obj</RobotMeshGrid>
            <Speed>29.0</Speed>
            <SpeedBack>29.3</SpeedBack>
            <TurningSpeed>20.5</TurningSpeed>
            <TurningSpeedBack>20.2</TurningSpeedBack>
            <Wheels>
                <Wheel driving="ДА">
                    <WheelMeshGrid>wheelMesh0.obj</WheelMeshGrid>
                    <WheelDiameter>9.0</WheelDiameter>
                    <WheelWidth>1.2</WheelWidth>
                </Wheel>
                <Wheel driving="НЕ">
                    <WheelMeshGrid>wheelMesh1.obj</WheelMeshGrid>
                    <WheelDiameter>9.8</WheelDiameter>
                    <WheelWidth>1.2</WheelWidth>
                </Wheel>
                <Wheel driving="НЕ">
                    <WheelMeshGrid>wheelMesh2.obj</WheelMeshGrid>
                    <WheelDiameter>9.8</WheelDiameter>
                    <WheelWidth>1.2</WheelWidth>
                </Wheel>
            </Wheels>
            <Sensors>
                <Sensor name="Сензор за измерване на разстоянието" valueType="разстояние">
                    <SensorMeshGrid>distSensorMesh.obj</SensorMeshGrid>
                    <NumberOfValusPerSecond>5</NumberOfValusPerSecond>
                </Sensor>
            </Sensors>
            <Rotors>
                <Rotor>
                    <RotorMeshGrid>RotorMesh0.obj</RotorMeshGrid>
                    <RotorLiftingPower>12.3</RotorLiftingPower>
                </Rotor>
                <Rotor>
                    <RotorMeshGrid>RotorMesh1.obj</RotorMeshGrid>
                    <RotorLiftingPower>12.3</RotorLiftingPower>
                </Rotor>
            </Rotors>
        </Robot>        
        <Robot id="IDR002" environments="IDE000 IDE001 IDE002" name="Робо О020" owner="Симеон">
            <RobotMeshGrid>mesh.obj</RobotMeshGrid>
            <Speed>24.8</Speed>
            <SpeedBack>24.7</SpeedBack>
            <TurningSpeed>24.8</TurningSpeed>
            <TurningSpeedBack>24.7</TurningSpeedBack>
            <Wheels>
                <Wheel driving="ДА">
                    <WheelMeshGrid>wheelMesh0.obj</WheelMeshGrid>
                    <WheelDiameter>3.0</WheelDiameter>
                    <WheelWidth>1.6</WheelWidth>
                </Wheel>
                <Wheel driving="ДА">
                    <WheelMeshGrid>wheelMesh1.obj</WheelMeshGrid>
                    <WheelDiameter>3.0</WheelDiameter>
                    <WheelWidth>1.6</WheelWidth>
                </Wheel>
                <Wheel driving="ДА">
                    <WheelMeshGrid>wheelMesh2.obj</WheelMeshGrid>
                    <WheelDiameter>4.0</WheelDiameter>
                    <WheelWidth>1.3</WheelWidth>
                </Wheel>
                <Wheel driving="ДА">
                    <WheelMeshGrid>wheelMesh3.obj</WheelMeshGrid>
                    <WheelDiameter>4.0</WheelDiameter>
                    <WheelWidth>1.3</WheelWidth>
                </Wheel>
            </Wheels>
            <Sensors>
                <Sensor name="Сензор за измерване на разстоянието" valueType="разстояние">
                    <SensorMeshGrid>distSensorMesh.obj</SensorMeshGrid>
                    <NumberOfValusPerSecond>4</NumberOfValusPerSecond>
                </Sensor>
            </Sensors>
            <Rotors>
                <Rotor>
                    <RotorMeshGrid>RotorMesh0.obj</RotorMeshGrid>
                    <RotorLiftingPower>6.0</RotorLiftingPower>
                </Rotor>
                <Rotor>
                    <RotorMeshGrid>RotorMesh1.obj</RotorMeshGrid>
                    <RotorLiftingPower>6.0</RotorLiftingPower>
                </Rotor>
                <Rotor>
                    <RotorMeshGrid>RotorMesh2.obj</RotorMeshGrid>
                    <RotorLiftingPower>3.0</RotorLiftingPower>
                </Rotor>
                <Rotor>
                    <RotorMeshGrid>RotorMesh3.obj</RotorMeshGrid>
                    <RotorLiftingPower>3.0</RotorLiftingPower>
                </Rotor>
            </Rotors>
        </Robot>           
        <Robot id="IDR003" environments="IDE000 IDE001" name="Робо КМ200" owner="Мони">
            <RobotMeshGrid>mesh.obj</RobotMeshGrid>
            <Speed>21.8</Speed>
            <SpeedBack>21.8</SpeedBack>
            <TurningSpeed>21.8</TurningSpeed>
            <TurningSpeedBack>21.8</TurningSpeedBack>
            <Wheels>
                <Wheel driving="ДА">
                    <WheelMeshGrid>wheelMesh0.obj</WheelMeshGrid>
                    <WheelDiameter>19.0</WheelDiameter>
                    <WheelWidth>1.3</WheelWidth>
                </Wheel>
                <Wheel driving="ДА">
                    <WheelMeshGrid>wheelMesh1.obj</WheelMeshGrid>
                    <WheelDiameter>19.0</WheelDiameter>
                    <WheelWidth>1.3</WheelWidth>
                </Wheel>
                <Wheel driving="ДА">
                    <WheelMeshGrid>wheelMesh2.obj</WheelMeshGrid>
                    <WheelDiameter>19.0</WheelDiameter>
                    <WheelWidth>1.1</WheelWidth>
                </Wheel>
                <Wheel driving="ДА">
                    <WheelMeshGrid>wheelMesh3.obj</WheelMeshGrid>
                    <WheelDiameter>19.0</WheelDiameter>
                    <WheelWidth>1.1</WheelWidth>
                </Wheel>
            </Wheels>
            <Sensors>
                <Sensor name="Сензор за измерване на топлината" valueType="топлина">
                    <SensorMeshGrid>tempSensorMesh.obj</SensorMeshGrid>
                    <NumberOfValusPerSecond>18</NumberOfValusPerSecond>
                </Sensor>
            </Sensors>
            <Rotors>
                <Rotor>
                    <RotorMeshGrid>RotorMesh0.obj</RotorMeshGrid>
                    <RotorLiftingPower>12.4</RotorLiftingPower>
                </Rotor>
                <Rotor>
                    <RotorMeshGrid>RotorMesh1.obj</RotorMeshGrid>
                    <RotorLiftingPower>12.4</RotorLiftingPower>
                </Rotor>
                <Rotor>
                    <RotorMeshGrid>RotorMesh2.obj</RotorMeshGrid>
                    <RotorLiftingPower>16.2</RotorLiftingPower>
                </Rotor>
                <Rotor>
                    <RotorMeshGrid>RotorMesh3.obj</RotorMeshGrid>
                    <RotorLiftingPower>16.2</RotorLiftingPower>
                </Rotor>
            </Rotors>
        </Robot>   
    </Robots>
    
    <Maps>
        <Map id="IDM000" environments="IDE000 IDE001 IDE002">
            <MapData>map000.bin</MapData>
            <Denivelation>9.3</Denivelation>
        </Map>
    </Maps>
    
    <Algorithms>
        <Algorithm id="IDA000" name="А звезда" diffEnvironments="ДА" multipleDestPoints="НЕ">
            <Complexity>Зависи от евристиката</Complexity>
            <Depth>55</Depth>
        </Algorithm>  
    </Algorithms>
</RoboSimulation>