<?xml version="1.0" encoding="UTF-8"?>
<!DOCTYPE RoboSimulation SYSTEM "RoboSim.dtd">
<RoboSimulation id="S0" name="Симулация 18" owner="Петран">
    <SimulationOwnerEmail>petran@gmail.com</SimulationOwnerEmail>
    <SimulationDescription>Описание на симулация 18</SimulationDescription>
    <SimulationRating>4.89</SimulationRating>
    <Environments>
        <Environment id="IDE000" name="Вода">
            <TravelCostEnter>1.0</TravelCostEnter>
            <TravelCostIn>1.0</TravelCostIn>
            <TravelCostExit>1.5</TravelCostExit>
            <Damage>3.5</Damage>
        </Environment>
        <Environment id="IDE001" name="Блато">
            <TravelCostEnter>1.0</TravelCostEnter>
            <TravelCostIn>2.0</TravelCostIn>
            <TravelCostExit>3.5</TravelCostExit>
            <Damage>6.5</Damage>
        </Environment>         
        <Environment id="IDE002" name="Земя">
            <TravelCostEnter>0.0</TravelCostEnter>
            <TravelCostIn>0.0</TravelCostIn>
            <TravelCostExit>0.5</TravelCostExit>
            <Damage>1.5</Damage>
        </Environment>  
    </Environments>
    
    <Robots>
        <Robot id="IDR000" name="Робо 008" owner="Сиси">
            <RobotMeshGrid>mesh.obj</RobotMeshGrid>
            <Speed>28.6</Speed>
            <SpeedBack>28.4</SpeedBack>
            <TurningSpeed>24.4</TurningSpeed>
            <TurningSpeedBack>24.4</TurningSpeedBack>
            <Wheels>
                <Wheel driving="ДА">
                    <WheelMeshGrid>wheelMesh0.obj</WheelMeshGrid>
                    <WheelDiameter>13.5</WheelDiameter>
                    <WheelWidth>21.7</WheelWidth>
                </Wheel>
                <Wheel driving="ДА">
                    <WheelMeshGrid>wheelMesh1.obj</WheelMeshGrid>
                    <WheelDiameter>13.5</WheelDiameter>
                    <WheelWidth>21.7</WheelWidth>
                </Wheel>
                <Wheel driving="ДА">
                    <WheelMeshGrid>wheelMesh2.obj</WheelMeshGrid>
                    <WheelDiameter>13.0</WheelDiameter>
                    <WheelWidth>11.7</WheelWidth>
                </Wheel>
                <Wheel driving="ДА">
                    <WheelMeshGrid>wheelMesh3.obj</WheelMeshGrid>
                    <WheelDiameter>13.0</WheelDiameter>
                    <WheelWidth>11.7</WheelWidth>
                </Wheel>
            </Wheels>
            <Sensors>
                <Sensor name="Сензор за измерване на топлината" valueType="топлина">
                    <SensorMeshGrid>tempSensorMesh.obj</SensorMeshGrid>
                    <NumberOfValusPerSecond>16</NumberOfValusPerSecond>
                </Sensor>
            </Sensors>
            <Rotors>
                <Rotor>
                    <RotorMeshGrid>RotorMesh0.obj</RotorMeshGrid>
                    <RotorLiftingPower>3.0</RotorLiftingPower>
                </Rotor>
                <Rotor>
                    <RotorMeshGrid>RotorMesh1.obj</RotorMeshGrid>
                    <RotorLiftingPower>3.0</RotorLiftingPower>
                </Rotor>
                <Rotor>
                    <RotorMeshGrid>RotorMesh2.obj</RotorMeshGrid>
                    <RotorLiftingPower>6.0</RotorLiftingPower>
                </Rotor>
                <Rotor>
                    <RotorMeshGrid>RotorMesh3.obj</RotorMeshGrid>
                    <RotorLiftingPower>6.0</RotorLiftingPower>
                </Rotor>
            </Rotors>
        </Robot>
        <Robot id="IDR001" name="Робо 009" owner="Марги">
            <RobotMeshGrid>mesh.obj</RobotMeshGrid>
            <Speed>15.0</Speed>
            <SpeedBack>15.4</SpeedBack>
            <TurningSpeed>15.0</TurningSpeed>
            <TurningSpeedBack>15.3</TurningSpeedBack>
            <Wheels>
                <Wheel driving="ДА">
                    <WheelMeshGrid>wheelMesh0.obj</WheelMeshGrid>
                    <WheelDiameter>12.5</WheelDiameter>
                    <WheelWidth>10.3</WheelWidth>
                </Wheel>
                <Wheel driving="ДА">
                    <WheelMeshGrid>wheelMesh1.obj</WheelMeshGrid>
                    <WheelDiameter>12.5</WheelDiameter>
                    <WheelWidth>10.3</WheelWidth>
                </Wheel>
                <Wheel driving="НЕ">
                    <WheelMeshGrid>wheelMesh2.obj</WheelMeshGrid>
                    <WheelDiameter>13.0</WheelDiameter>
                    <WheelWidth>10.3</WheelWidth>
                </Wheel>
            </Wheels>
            <Rotors>
                <Rotor>
                    <RotorMeshGrid>RotorMesh0.obj</RotorMeshGrid>
                    <RotorLiftingPower>30.0</RotorLiftingPower>
                </Rotor>
            </Rotors>
        </Robot>
        <Robot id="IDR002" name="Робо 010" owner="Бианка">
            <RobotMeshGrid>mesh.obj</RobotMeshGrid>
            <Speed>19.0</Speed>
            <SpeedBack>18.6</SpeedBack>
            <TurningSpeed>17.7</TurningSpeed>
            <TurningSpeedBack>17.4</TurningSpeedBack>
            <Wheels>
                <Wheel driving="ДА">
                    <WheelMeshGrid>wheelMesh0.obj</WheelMeshGrid>
                    <WheelDiameter>13.7</WheelDiameter>
                    <WheelWidth>10.9</WheelWidth>
                </Wheel>
                <Wheel driving="ДА">
                    <WheelMeshGrid>wheelMesh1.obj</WheelMeshGrid>
                    <WheelDiameter>3.7</WheelDiameter>
                    <WheelWidth>10.9</WheelWidth>
                </Wheel>
                <Wheel driving="НЕ">
                    <WheelMeshGrid>wheelMesh2.obj</WheelMeshGrid>
                    <WheelDiameter>1.7</WheelDiameter>
                    <WheelWidth>10.9</WheelWidth>
                </Wheel>
                <Wheel driving="НЕ">
                    <WheelMeshGrid>wheelMesh3.obj</WheelMeshGrid>
                    <WheelDiameter>1.7</WheelDiameter>
                    <WheelWidth>10.9</WheelWidth>
                </Wheel>
            </Wheels>
            <Sensors>
                <Sensor name="Сензор за измерване на топлината" valueType="топлина">
                    <SensorMeshGrid>tempSensorMesh.obj</SensorMeshGrid>
                    <NumberOfValusPerSecond>6</NumberOfValusPerSecond>
                </Sensor>
                <Sensor name="Сензор за измерване на звука" valueType="звук">
                    <SensorMeshGrid>distSensorMesh.obj</SensorMeshGrid>
                    <NumberOfValusPerSecond>5</NumberOfValusPerSecond>
                </Sensor>
            </Sensors>
            <Rotors>
                <Rotor>
                    <RotorMeshGrid>RotorMesh0.obj</RotorMeshGrid>
                    <RotorLiftingPower>4.6</RotorLiftingPower>
                </Rotor>
                <Rotor>
                    <RotorMeshGrid>RotorMesh1.obj</RotorMeshGrid>
                    <RotorLiftingPower>4.6</RotorLiftingPower>
                </Rotor>
            </Rotors>
        </Robot>
    </Robots>
    
    <Maps>
        <Map id="IDM000" name="Карта 1">
            <MapData>map000.bin</MapData>
            <Denivelation>4</Denivelation>
        </Map>
        <Map id="IDM001" name="Карта 2">
            <MapData>map001.bin</MapData>
            <Denivelation>0</Denivelation>
        </Map>
        <Map id="IDM002" name="Карта 3">
            <MapData>map002.bin</MapData>
            <Denivelation>10</Denivelation>
        </Map>
        <Map id="IDM003" name="Карта 4">
            <MapData>map003.bin</MapData>
            <Denivelation>0</Denivelation>
        </Map>
    </Maps>
    
    <Algorithms>
        <Algorithm id="IDA000" name="Търсене в дълбочина" diffEnvironments="НЕ" multipleDestPoints="ДА">
            <Complexity>Линейна</Complexity>
            <Depth>25</Depth>
        </Algorithm> 
        <Algorithm id="IDA001" name="Най-бързото спускане" diffEnvironments="НЕ" multipleDestPoints="НЕ">
            <Complexity>Линейно по пътя с евристика</Complexity>
            <Depth>25</Depth>
        </Algorithm>      
    </Algorithms>
</RoboSimulation>