<?xml version="1.0" encoding="UTF-8"?>
<!DOCTYPE RoboSimulation SYSTEM "RoboSim.dtd">
<RoboSimulation id="S0">
    <SimulationName>Симулация 7</SimulationName>
    <SimulationOwner>Мирела</SimulationOwner>
    <SimulationOwnerEmail>antonvdudov@gmail.com</SimulationOwnerEmail>
    <Environments>
        <Environment id="IDE000" name="Земя">
            <TravelCostEnter>1.0</TravelCostEnter>
            <TravelCostIn>1.0</TravelCostIn>
            <TravelCostExit>2.0</TravelCostExit>
            <Damage>0.0</Damage>
        </Environment>
        <Environment id="IDE001" name="Вода">
            <TravelCostEnter>1.6</TravelCostEnter>
            <TravelCostIn>3.1</TravelCostIn>
            <TravelCostExit>1.8</TravelCostExit>
            <Damage>1.5</Damage>
        </Environment>
        <Environment id="IDE002" name="Въздух">
            <TravelCostEnter>2.2</TravelCostEnter>
            <TravelCostIn>1.6</TravelCostIn>
            <TravelCostExit>1.0</TravelCostExit>
            <Damage>0.0</Damage>
        </Environment>     
    </Environments>
    
    <Robots>
        <Robot id="IDR000" environments="IDE000 IDE001" name="Робо ДВ40" owner="Петър">
            <RobotMeshGrid>mesh.obj</RobotMeshGrid>
            <Speed>17.0</Speed>
            <SpeedBack>16.3</SpeedBack>
            <TurningSpeed>18.0</TurningSpeed>
            <TurningSpeedBack>18.2</TurningSpeedBack>
            <Wheels>
                <Wheel driving="ДА">
                    <WheelMeshGrid>wheelMesh0.obj</WheelMeshGrid>
                    <WheelDiameter>2.5</WheelDiameter>
                    <WheelWidth>1.0</WheelWidth>
                </Wheel>
                <Wheel driving="ДА">
                    <WheelMeshGrid>wheelMesh1.obj</WheelMeshGrid>
                    <WheelDiameter>2.5</WheelDiameter>
                    <WheelWidth>1.0</WheelWidth>
                </Wheel>
                <Wheel driving="ДА">
                    <WheelMeshGrid>wheelMesh2.obj</WheelMeshGrid>
                    <WheelDiameter>3.0</WheelDiameter>
                    <WheelWidth>1.0</WheelWidth>
                </Wheel>
            </Wheels>
            <Sensors>
                <Sensor name="Сензор за измерване на топлината" valueType="топлина">
                    <SensorMeshGrid>tempSensorMesh.obj</SensorMeshGrid>
                    <NumberOfValusPerSecond>7</NumberOfValusPerSecond>
                </Sensor>
            </Sensors>
        </Robot>        
        <Robot id="IDR001" environments="IDE000 IDE002" name="Робо КЛМ000" owner="Борка">
            <RobotMeshGrid>mesh.obj</RobotMeshGrid>
            <Speed>19.0</Speed>
            <SpeedBack>19.3</SpeedBack>
            <TurningSpeed>13.5</TurningSpeed>
            <TurningSpeedBack>13.2</TurningSpeedBack>
            <Wheels>
                <Wheel driving="ДА">
                    <WheelMeshGrid>wheelMesh0.obj</WheelMeshGrid>
                    <WheelDiameter>6.0</WheelDiameter>
                    <WheelWidth>1.2</WheelWidth>
                </Wheel>
                <Wheel driving="НЕ">
                    <WheelMeshGrid>wheelMesh1.obj</WheelMeshGrid>
                    <WheelDiameter>3.8</WheelDiameter>
                    <WheelWidth>1.6</WheelWidth>
                </Wheel>
                <Wheel driving="НЕ">
                    <WheelMeshGrid>wheelMesh2.obj</WheelMeshGrid>
                    <WheelDiameter>3.8</WheelDiameter>
                    <WheelWidth>1.6</WheelWidth>
                </Wheel>
            </Wheels>
            <Sensors>
                <Sensor name="Сензор за измерване на топлината" valueType="топлина">
                    <SensorMeshGrid>tempSensorMesh.obj</SensorMeshGrid>
                    <NumberOfValusPerSecond>2</NumberOfValusPerSecond>
                </Sensor>
                <Sensor name="Сензор за измерване на разстоянието" valueType="разстояние">
                    <SensorMeshGrid>distSensorMesh.obj</SensorMeshGrid>
                    <NumberOfValusPerSecond>4</NumberOfValusPerSecond>
                </Sensor>
            </Sensors>
            <Rotors>
                <Rotor>
                    <RotorMeshGrid>RotorMesh0.obj</RotorMeshGrid>
                    <RotorLiftingPower>2.0</RotorLiftingPower>
                </Rotor>
                <Rotor>
                    <RotorMeshGrid>RotorMesh1.obj</RotorMeshGrid>
                    <RotorLiftingPower>2.0</RotorLiftingPower>
                </Rotor>
            </Rotors>
        </Robot>        
        <Robot id="IDR002" environments="IDE000 IDE001 IDE002" name="Робо МС540" owner="Силвестър">
            <RobotMeshGrid>mesh.obj</RobotMeshGrid>
            <Speed>24.2</Speed>
            <SpeedBack>24.1</SpeedBack>
            <TurningSpeed>24.0</TurningSpeed>
            <TurningSpeedBack>24.6</TurningSpeedBack>
            <Wheels>
                <Wheel driving="ДА">
                    <WheelMeshGrid>wheelMesh0.obj</WheelMeshGrid>
                    <WheelDiameter>6.0</WheelDiameter>
                    <WheelWidth>1.5</WheelWidth>
                </Wheel>
                <Wheel driving="ДА">
                    <WheelMeshGrid>wheelMesh1.obj</WheelMeshGrid>
                    <WheelDiameter>6.0</WheelDiameter>
                    <WheelWidth>1.5</WheelWidth>
                </Wheel>
                <Wheel driving="ДА">
                    <WheelMeshGrid>wheelMesh2.obj</WheelMeshGrid>
                    <WheelDiameter>4.0</WheelDiameter>
                    <WheelWidth>1.1</WheelWidth>
                </Wheel>
                <Wheel driving="ДА">
                    <WheelMeshGrid>wheelMesh3.obj</WheelMeshGrid>
                    <WheelDiameter>4.0</WheelDiameter>
                    <WheelWidth>1.1</WheelWidth>
                </Wheel>
            </Wheels>
            <Rotors>
                <Rotor>
                    <RotorMeshGrid>RotorMesh0.obj</RotorMeshGrid>
                    <RotorLiftingPower>21.0</RotorLiftingPower>
                </Rotor>
                <Rotor>
                    <RotorMeshGrid>RotorMesh1.obj</RotorMeshGrid>
                    <RotorLiftingPower>21.0</RotorLiftingPower>
                </Rotor>
                <Rotor>
                    <RotorMeshGrid>RotorMesh2.obj</RotorMeshGrid>
                    <RotorLiftingPower>11.0</RotorLiftingPower>
                </Rotor>
                <Rotor>
                    <RotorMeshGrid>RotorMesh3.obj</RotorMeshGrid>
                    <RotorLiftingPower>11.0</RotorLiftingPower>
                </Rotor>
            </Rotors>
        </Robot>     
    </Robots>
    
    <Maps>
        <Map id="IDM000" environments="IDE000 IDE001 IDE002">
            <MapData>map000.bin</MapData>
            <Denivelation>0</Denivelation>
        </Map>
    </Maps>
    
    <Algorithms>
        <Algorithm id="IDA000" name="А звезда" diffEnvironments="ДА" multipleDestPoints="ДА">
            <Complexity>Зависи от евристиката</Complexity>
            <Depth>27</Depth>
        </Algorithm>  
    </Algorithms>
</RoboSimulation>