<?xml version="1.0" encoding="UTF-8"?>
<!DOCTYPE RoboSimulation SYSTEM "RoboSim.dtd">
<RoboSimulation>
    <SimulationName>Симулация 13</SimulationName>
    <SimulationOwner>Васил</SimulationOwner>
    <SimulationOwnerEmail>vasil@gmail.com</SimulationOwnerEmail>
    <Environments>
        <Environment id="IDE000" name="Вода">
            <TravelCostEnter>1.0</TravelCostEnter>
            <TravelCostIn>2.0</TravelCostIn>
            <TravelCostExit>1.3</TravelCostExit>
            <Damage>1.5</Damage>
        </Environment>     
        <Environment id="IDE001" name="Земя">
            <TravelCostEnter>1.3</TravelCostEnter>
            <TravelCostIn>1.1</TravelCostIn>
            <TravelCostExit>1.3</TravelCostExit>
            <Damage>0.3</Damage>
        </Environment>   
    </Environments>
    
    <Robots>
        <Robot id="IDR000" environments="IDE000 IDE001" name="Робо Е200" owner="Чарли">
            <RobotMeshGrid>mesh.obj</RobotMeshGrid>
            <Speed>16.6</Speed>
            <SpeedBack>15.4</SpeedBack>
            <TurningSpeed>18.5</TurningSpeed>
            <TurningSpeedBack>12.5</TurningSpeedBack>
            <Wheels>
                <Wheel driving="ДА">
                    <WheelMeshGrid>wheelMesh0.obj</WheelMeshGrid>
                    <WheelDiameter>5.5</WheelDiameter>
                    <WheelWidth>1.3</WheelWidth>
                </Wheel>
                <Wheel driving="НЕ">
                    <WheelMeshGrid>wheelMesh1.obj</WheelMeshGrid>
                    <WheelDiameter>6.0</WheelDiameter>
                    <WheelWidth>1.3</WheelWidth>
                </Wheel>
                <Wheel driving="НЕ">
                    <WheelMeshGrid>wheelMesh2.obj</WheelMeshGrid>
                    <WheelDiameter>6.0</WheelDiameter>
                    <WheelWidth>1.3</WheelWidth>
                </Wheel>
            </Wheels>
            <Sensors>
                <Sensor name="Сензор за измерване на топлината" valueType="топлина">
                    <SensorMeshGrid>tempSensorMesh.obj</SensorMeshGrid>
                    <NumberOfValusPerSecond>2</NumberOfValusPerSecond>
                </Sensor>
            </Sensors>
            <Rotors>
                <Rotor>
                    <RotorMeshGrid>RotorMesh0.obj</RotorMeshGrid>
                    <RotorLiftingPower>6.0</RotorLiftingPower>
                </Rotor>
                <Rotor>
                    <RotorMeshGrid>RotorMesh1.obj</RotorMeshGrid>
                    <RotorLiftingPower>6.0</RotorLiftingPower>
                </Rotor>
                <Rotor>
                    <RotorMeshGrid>RotorMesh2.obj</RotorMeshGrid>
                    <RotorLiftingPower>6.0</RotorLiftingPower>
                </Rotor>
                <Rotor>
                    <RotorMeshGrid>RotorMesh3.obj</RotorMeshGrid>
                    <RotorLiftingPower>6.0</RotorLiftingPower>
                </Rotor>
            </Rotors>
        </Robot>
        <Robot id="IDR001" environments="IDE000 IDE001" name="Робо ЕВ233" owner="Наско">
            <RobotMeshGrid>mesh.obj</RobotMeshGrid>
            <Speed>13.1</Speed>
            <SpeedBack>13.6</SpeedBack>
            <TurningSpeed>12.1</TurningSpeed>
            <TurningSpeedBack>12.2</TurningSpeedBack>
            <Wheels>
                <Wheel driving="ДА">
                    <WheelMeshGrid>wheelMesh0.obj</WheelMeshGrid>
                    <WheelDiameter>4.5</WheelDiameter>
                    <WheelWidth>2.7</WheelWidth>
                </Wheel>
                <Wheel driving="ДА">
                    <WheelMeshGrid>wheelMesh1.obj</WheelMeshGrid>
                    <WheelDiameter>4.5</WheelDiameter>
                    <WheelWidth>2.7</WheelWidth>
                </Wheel>
                <Wheel driving="НЕ">
                    <WheelMeshGrid>wheelMesh2.obj</WheelMeshGrid>
                    <WheelDiameter>5.5</WheelDiameter>
                    <WheelWidth>1.3</WheelWidth>
                </Wheel>
                <Wheel driving="ДА">
                    <WheelMeshGrid>wheelMesh3.obj</WheelMeshGrid>
                    <WheelDiameter>5.5</WheelDiameter>
                    <WheelWidth>1.3</WheelWidth>
                </Wheel>
            </Wheels>
            <Rotors>
                <Rotor>
                    <RotorMeshGrid>RotorMesh0.obj</RotorMeshGrid>
                    <RotorLiftingPower>14.3</RotorLiftingPower>
                </Rotor>
                <Rotor>
                    <RotorMeshGrid>RotorMesh1.obj</RotorMeshGrid>
                    <RotorLiftingPower>14.3</RotorLiftingPower>
                </Rotor>
                <Rotor>
                    <RotorMeshGrid>RotorMesh2.obj</RotorMeshGrid>
                    <RotorLiftingPower>14.3</RotorLiftingPower>
                </Rotor>
            </Rotors>
        </Robot>
        <Robot id="IDR002" environments="IDE001" name="Робо МК20" owner="Ваньо">
            <RobotMeshGrid>mesh.obj</RobotMeshGrid>
            <Speed>19.0</Speed>
            <SpeedBack>18.6</SpeedBack>
            <TurningSpeed>25.0</TurningSpeed>
            <TurningSpeedBack>25.4</TurningSpeedBack>
            <Sensors>
                <Sensor name="Сензор за измерване на топлината" valueType="топлина">
                    <SensorMeshGrid>tempSensorMesh.obj</SensorMeshGrid>
                    <NumberOfValusPerSecond>6</NumberOfValusPerSecond>
                </Sensor>
            </Sensors>
            <Rotors>
                <Rotor>
                    <RotorMeshGrid>RotorMesh0.obj</RotorMeshGrid>
                    <RotorLiftingPower>14.0</RotorLiftingPower>
                </Rotor>
                <Rotor>
                    <RotorMeshGrid>RotorMesh1.obj</RotorMeshGrid>
                    <RotorLiftingPower>14.0</RotorLiftingPower>
                </Rotor>
            </Rotors>
        </Robot>
    </Robots>
    
    <Maps>
        <Map id="IDM000" environments="IDE000 IDE001">
            <MapData>map000.bin</MapData>
            <Denivelation>4</Denivelation>
        </Map>
        <Map id="IDM001" environments="IDE001">
            <MapData>map001.bin</MapData>
            <Denivelation>0</Denivelation>
        </Map>
    </Maps>
    
    <Algorithms>
        <Algorithm id="IDA000" name="Търсене в дълбочина" diffEnvironments="НЕ" multipleDestPoints="ДА">
            <Complexity>Линейна</Complexity>
            <Depth>21</Depth>
        </Algorithm> 
        <Algorithm id="IDA001" name="Най-бързото спускане" diffEnvironments="НЕ" multipleDestPoints="НЕ">
            <Complexity>Линейно по пътя с евристика</Complexity>
            <Depth>Нелимитирано</Depth>
        </Algorithm>   
    </Algorithms>
</RoboSimulation>